{
  "schema_version": "1.1",
  "configured_think": null,
  "measurement_scope": "synthetic_context_answer_conformance",
  "measurement_revision": "afd703b5d9d13eb6dd5d79e36a928c1fed9309d8",
  "character_card_sha256": "115fe849f08055dd141cde3aff20802ff406ff172d8f4a569c2dd039b465b709",
  "expected": 36,
  "recorded": 36,
  "passed": 28,
  "failed": 8,
  "memory_retrieval_exercised": false,
  "natural_speech_style_verified": false,
  "response_content_persisted": false,
  "trials": [
    {
      "case_index": 0,
      "variant": "configured",
      "trial_index": 0,
      "strict_format_valid": false,
      "format_valid": true,
      "name_correct": true,
      "history_correct": true,
      "memory_correct": true,
      "request_completed": true,
      "provider_internal_timing_unavailable_recorded": true,
      "passed": true
    },
    {
      "case_index": 0,
      "variant": "configured",
      "trial_index": 1,
      "strict_format_valid": false,
      "format_valid": true,
      "name_correct": false,
      "history_correct": true,
      "memory_correct": true,
      "request_completed": true,
      "provider_internal_timing_unavailable_recorded": true,
      "passed": false
    },
    {
      "case_index": 0,
      "variant": "configured",
      "trial_index": 2,
      "strict_format_valid": false,
      "format_valid": true,
      "name_correct": true,
      "history_correct": true,
      "memory_correct": true,
      "request_completed": true,
      "provider_internal_timing_unavailable_recorded": true,
      "passed": true
    },
    {
      "case_index": 1,
      "variant": "configured",
      "trial_index": 0,
      "strict_format_valid": false,
      "format_valid": true,
      "name_correct": false,
      "history_correct": true,
      "memory_correct": true,
      "request_completed": true,
      "provider_internal_timing_unavailable_recorded": true,
      "passed": false
    },
    {
      "case_index": 1,
      "variant": "configured",
      "trial_index": 1,
      "strict_format_valid": false,
      "format_valid": true,
      "name_correct": false,
      "history_correct": true,
      "memory_correct": true,
      "request_completed": true,
      "provider_internal_timing_unavailable_recorded": true,
      "passed": false
    },
    {
      "case_index": 1,
      "variant": "configured",
      "trial_index": 2,
      "strict_format_valid": false,
      "format_valid": true,
      "name_correct": true,
      "history_correct": true,
      "memory_correct": true,
      "request_completed": true,
      "provider_internal_timing_unavailable_recorded": true,
      "passed": true
    },
    {
      "case_index": 2,
      "variant": "configured",
      "trial_index": 0,
      "strict_format_valid": false,
      "format_valid": true,
      "name_correct": true,
      "history_correct": true,
      "memory_correct": true,
      "request_completed": true,
      "provider_internal_timing_unavailable_recorded": true,
      "passed": true
    },
    {
      "case_index": 2,
      "variant": "configured",
      "trial_index": 1,
      "strict_format_valid": false,
      "format_valid": true,
      "name_correct": false,
      "history_correct": true,
      "memory_correct": true,
      "request_completed": true,
      "provider_internal_timing_unavailable_recorded": true,
      "passed": false
    },
    {
      "case_index": 2,
      "variant": "configured",
      "trial_index": 2,
      "strict_format_valid": false,
      "format_valid": true,
      "name_correct": false,
      "history_correct": true,
      "memory_correct": true,
      "request_completed": true,
      "provider_internal_timing_unavailable_recorded": true,
      "passed": false
    },
    {
      "case_index": 3,
      "variant": "configured",
      "trial_index": 0,
      "strict_format_valid": false,
      "format_valid": true,
      "name_correct": true,
      "history_correct": true,
      "memory_correct": true,
      "request_completed": true,
      "provider_internal_timing_unavailable_recorded": true,
      "passed": true
    },
    {
      "case_index": 3,
      "variant": "configured",
      "trial_index": 1,
      "strict_format_valid": false,
      "format_valid": true,
      "name_correct": false,
      "history_correct": true,
      "memory_correct": true,
      "request_completed": true,
      "provider_internal_timing_unavailable_recorded": true,
      "passed": false
    },
    {
      "case_index": 3,
      "variant": "configured",
      "trial_index": 2,
      "strict_format_valid": false,
      "format_valid": true,
      "name_correct": true,
      "history_correct": true,
      "memory_correct": true,
      "request_completed": true,
      "provider_internal_timing_unavailable_recorded": true,
      "passed": true
    },
    {
      "case_index": 4,
      "variant": "configured",
      "trial_index": 0,
      "strict_format_valid": false,
      "format_valid": true,
      "name_correct": true,
      "history_correct": true,
      "memory_correct": true,
      "request_completed": true,
      "provider_internal_timing_unavailable_recorded": true,
      "passed": true
    },
    {
      "case_index": 4,
      "variant": "configured",
      "trial_index": 1,
      "strict_format_valid": false,
      "format_valid": true,
      "name_correct": true,
      "history_correct": true,
      "memory_correct": true,
      "request_completed": true,
      "provider_internal_timing_unavailable_recorded": true,
      "passed": true
    },
    {
      "case_index": 4,
      "variant": "configured",
      "trial_index": 2,
      "strict_format_valid": false,
      "format_valid": true,
      "name_correct": true,
      "history_correct": true,
      "memory_correct": true,
      "request_completed": true,
      "provider_internal_timing_unavailable_recorded": true,
      "passed": true
    },
    {
      "case_index": 5,
      "variant": "configured",
      "trial_index": 0,
      "strict_format_valid": false,
      "format_valid": true,
      "name_correct": false,
      "history_correct": true,
      "memory_correct": true,
      "request_completed": true,
      "provider_internal_timing_unavailable_recorded": true,
      "passed": false
    },
    {
      "case_index": 5,
      "variant": "configured",
      "trial_index": 1,
      "strict_format_valid": false,
      "format_valid": true,
      "name_correct": false,
      "history_correct": true,
      "memory_correct": true,
      "request_completed": true,
      "provider_internal_timing_unavailable_recorded": true,
      "passed": false
    },
    {
      "case_index": 5,
      "variant": "configured",
      "trial_index": 2,
      "strict_format_valid": false,
      "format_valid": true,
      "name_correct": true,
      "history_correct": true,
      "memory_correct": true,
      "request_completed": true,
      "provider_internal_timing_unavailable_recorded": true,
      "passed": true
    },
    {
      "case_index": 0,
      "variant": "thinking_disabled",
      "trial_index": 0,
      "strict_format_valid": true,
      "format_valid": true,
      "name_correct": true,
      "history_correct": true,
      "memory_correct": true,
      "request_completed": true,
      "provider_internal_timing_unavailable_recorded": true,
      "passed": true
    },
    {
      "case_index": 0,
      "variant": "thinking_disabled",
      "trial_index": 1,
      "strict_format_valid": true,
      "format_valid": true,
      "name_correct": true,
      "history_correct": true,
      "memory_correct": true,
      "request_completed": true,
      "provider_internal_timing_unavailable_recorded": true,
      "passed": true
    },
    {
      "case_index": 0,
      "variant": "thinking_disabled",
      "trial_index": 2,
      "strict_format_valid": false,
      "format_valid": true,
      "name_correct": true,
      "history_correct": true,
      "memory_correct": true,
      "request_completed": true,
      "provider_internal_timing_unavailable_recorded": true,
      "passed": true
    },
    {
      "case_index": 1,
      "variant": "thinking_disabled",
      "trial_index": 0,
      "strict_format_valid": true,
      "format_valid": true,
      "name_correct": true,
      "history_correct": true,
      "memory_correct": true,
      "request_completed": true,
      "provider_internal_timing_unavailable_recorded": true,
      "passed": true
    },
    {
      "case_index": 1,
      "variant": "thinking_disabled",
      "trial_index": 1,
      "strict_format_valid": true,
      "format_valid": true,
      "name_correct": true,
      "history_correct": true,
      "memory_correct": true,
      "request_completed": true,
      "provider_internal_timing_unavailable_recorded": true,
      "passed": true
    },
    {
      "case_index": 1,
      "variant": "thinking_disabled",
      "trial_index": 2,
      "strict_format_valid": false,
      "format_valid": true,
      "name_correct": true,
      "history_correct": true,
      "memory_correct": true,
      "request_completed": true,
      "provider_internal_timing_unavailable_recorded": true,
      "passed": true
    },
    {
      "case_index": 2,
      "variant": "thinking_disabled",
      "trial_index": 0,
      "strict_format_valid": true,
      "format_valid": true,
      "name_correct": true,
      "history_correct": true,
      "memory_correct": true,
      "request_completed": true,
      "provider_internal_timing_unavailable_recorded": true,
      "passed": true
    },
    {
      "case_index": 2,
      "variant": "thinking_disabled",
      "trial_index": 1,
      "strict_format_valid": true,
      "format_valid": true,
      "name_correct": true,
      "history_correct": true,
      "memory_correct": true,
      "request_completed": true,
      "provider_internal_timing_unavailable_recorded": true,
      "passed": true
    },
    {
      "case_index": 2,
      "variant": "thinking_disabled",
      "trial_index": 2,